{"schema_version":1,"ok":true,"state":"healthy","changed":false,"findings":[{"code":"REVIEW_INDEPENDENCE","message":"A different agent (Claude) checked the work in a separate headless process.","severity":"info"},{"code":"REVIEWER_SUMMARY","message":"The planning artifacts are internally consistent. The 14 blocks expand to 37 cases (1+4+1+3+2+2+1+6+6+3+3+3+1+1). The 33 deferrals match the owner totals (DRD65E 1, KKP2R3 2, MCWV4B 18, FC33HK 12). There are 11 distinct mapped Vitest files, and the 42 R/G/R entries (14×3) match delivery-state.md. The plan claims no completion, RED or certification authority. It keeps T3E4NS open, keeps CKWE2D's retrospective path limited to CKWE2D, and treats #5857 as a source of reusable mechanisms rather than authority. It names the unresolved design obligations explicitly. I found no release-relevant error. The warnings are about where identities come from and how freshness is bound. The future recovery contract should settle these.","severity":"info"},{"code":"REVIEWER_FINDING","message":"In proof-inventory.json, `historicalDeferrals.source` points to revision d593765c (packages/cli/src/review/ledger-recovery-cases.json), which appears to be the unmerged #5857 lineage. recovery-plan.md says that baseline is not an ancestor of main and that reusing it would import stale authority. Yet the plan tells the future contract to 'preserve all 33 historical deferred objects', and their only digests come from that non-main file. The future contract should derive or cross-check the 33 deferral identities against main's own 5F5ZZA feature and ledger (the 5F5ZZA hashes recorded in the inventory). Otherwise a stale case identity could be locked in as the thing preserved. All `stepDigests` are empty, so swap detection currently depends on name, line and digest alone.","severity":"warning"},{"code":"REVIEWER_FINDING","message":"Step 1 binds 'ticket identity, accepted scope/Rules, feature, proof map, ledger' to a reviewed profile. The inventory's identity set includes T3E4NS delivery-state.md and ticket.md, and both will legitimately change during recovery and closing. The plan does not separate mutable lifecycle records from frozen inputs. It only says 'preserve audited lifecycle writes without excluding any execution input from freshness checks'. That leaves two reasonable implementations: one stales itself on every status write, and the other exempts too much. The future contract should state which files are frozen inputs and which are audited lifecycle outputs.","severity":"warning"},{"code":"REVIEWER_FINDING","message":"Some current proof registrations fit their blocks loosely. For example, 'Route admission binds exact identity and current input bytes' is mapped to 'preserves admitted degraded labeling and deterministically exhausts an empty set'. 'A failed independent attempt precedes eligible fallback' has 2 cases, but its parameterized test spans declaration order, failure type, author model and confirmation. The plan correctly says registrations are not certificates and unsupported rows must stay explicit. Certification should still require a row-level mapping for each parameterized test before any case counts as covered, including the 'either declaration order' quantifier.","severity":"warning"},{"code":"REVIEWER_FINDING","message":"The plan's limits are well bounded. It forbids broadening RETROSPECTIVE_TICKET, borrowing CKWE2D/5F5ZZA receipts, fabricating RED, crediting deferrals, letting simulated wiring count as installed-host closing, and treating unavailable certification as an implied waiver. These match retrospective-history-core.ts, the T3E4NS spec and delivery-state.md.","severity":"info"},{"code":"REVIEWER_FINDING","message":"The proposal covers a lot of mechanism for one late ticket: an observer, typed certification, a distinct signing purpose and a closing transition. The plan justifies this by the lack of any supported late-ticket completion path, and it defers the design to normal behavior and planning gates, so it is not unnecessary complexity at this stage. Reviewers of the implementation should check that it does not build a second mechanism parallel to the CKWE2D path.","severity":"info"}],"effects":{"files":[],"packages":[],"configuration":[],"network":[{"kind":"review","target":"claude","operation":"request"}],"destructive":[]},"errors":[],"recovery":[],"next_actions":[],"data":{"command":"review run","status":"approved","review_kind":"quality-review","review_targets":[".project/tickets/C7HCN7-prepare-bounded-completion-recovery/recovery-plan.md",".project/tickets/C7HCN7-prepare-bounded-completion-recovery/proof-map.md"],"author_agent":"codex","assigned_reviewer":"claude","actual_reviewer":"claude","reviewer_model":"opus","independence":"cross-agent","reviewer_output":{"schema_version":1,"dispatch_id":"ccb07ce2-ccc4-4726-9235-0a4ec4165b5f","reviewer_agent":"claude","verdict":"approve","summary":"The planning artifacts are internally consistent. The 14 blocks expand to 37 cases (1+4+1+3+2+2+1+6+6+3+3+3+1+1). The 33 deferrals match the owner totals (DRD65E 1, KKP2R3 2, MCWV4B 18, FC33HK 12). There are 11 distinct mapped Vitest files, and the 42 R/G/R entries (14×3) match delivery-state.md. The plan claims no completion, RED or certification authority. It keeps T3E4NS open, keeps CKWE2D's retrospective path limited to CKWE2D, and treats #5857 as a source of reusable mechanisms rather than authority. It names the unresolved design obligations explicitly. I found no release-relevant error. The warnings are about where identities come from and how freshness is bound. The future recovery contract should settle these.","findings":[{"severity":"warning","message":"In proof-inventory.json, `historicalDeferrals.source` points to revision d593765c (packages/cli/src/review/ledger-recovery-cases.json), which appears to be the unmerged #5857 lineage. recovery-plan.md says that baseline is not an ancestor of main and that reusing it would import stale authority. Yet the plan tells the future contract to 'preserve all 33 historical deferred objects', and their only digests come from that non-main file. The future contract should derive or cross-check the 33 deferral identities against main's own 5F5ZZA feature and ledger (the 5F5ZZA hashes recorded in the inventory). Otherwise a stale case identity could be locked in as the thing preserved. All `stepDigests` are empty, so swap detection currently depends on name, line and digest alone."},{"severity":"warning","message":"Step 1 binds 'ticket identity, accepted scope/Rules, feature, proof map, ledger' to a reviewed profile. The inventory's identity set includes T3E4NS delivery-state.md and ticket.md, and both will legitimately change during recovery and closing. The plan does not separate mutable lifecycle records from frozen inputs. It only says 'preserve audited lifecycle writes without excluding any execution input from freshness checks'. That leaves two reasonable implementations: one stales itself on every status write, and the other exempts too much. The future contract should state which files are frozen inputs and which are audited lifecycle outputs."},{"severity":"warning","message":"Some current proof registrations fit their blocks loosely. For example, 'Route admission binds exact identity and current input bytes' is mapped to 'preserves admitted degraded labeling and deterministically exhausts an empty set'. 'A failed independent attempt precedes eligible fallback' has 2 cases, but its parameterized test spans declaration order, failure type, author model and confirmation. The plan correctly says registrations are not certificates and unsupported rows must stay explicit. Certification should still require a row-level mapping for each parameterized test before any case counts as covered, including the 'either declaration order' quantifier."},{"severity":"info","message":"The plan's limits are well bounded. It forbids broadening RETROSPECTIVE_TICKET, borrowing CKWE2D/5F5ZZA receipts, fabricating RED, crediting deferrals, letting simulated wiring count as installed-host closing, and treating unavailable certification as an implied waiver. These match retrospective-history-core.ts, the T3E4NS spec and delivery-state.md."},{"severity":"info","message":"The proposal covers a lot of mechanism for one late ticket: an observer, typed certification, a distinct signing purpose and a closing transition. The plan justifies this by the lack of any supported late-ticket completion path, and it defers the design to normal behavior and planning gates, so it is not unnecessary complexity at this stage. Reviewers of the implementation should check that it does not build a second mechanism parallel to the CKWE2D path."}]},"excluded_targets":[],"review_id":"44b8b9d3-dd5d-4131-a852-e5cf468c6a06","review_excluded_targets":[]}}
