{"schema_version":1,"ok":true,"state":"action_required","changed":false,"findings":[{"code":"REVIEW_PENDING","message":"The independent review is still working in the background. Collect its result when it finishes.","severity":"info"}],"effects":{"files":[],"packages":[],"configuration":[],"network":[],"destructive":[]},"errors":[],"recovery":[],"next_actions":[{"command":"/Users/alex/.local/share/mise/installs/bun/1.3.14/bin/bun /Users/alex/.codex/plugins/cache/safeword/safeword/1.2.0/runtime/cli.js review status 02557913-e9d6-4653-ac84-143bd1eb46a7","mutates":false,"requires_human":false}],"data":{"command":"review run","status":"pending","review_id":"02557913-e9d6-4653-ac84-143bd1eb46a7","started_at":"2026-10-24T06:35:06.961Z"}}
