{"schema_version":1,"ok":true,"state":"action_required","changed":false,"findings":[{"code":"REVIEW_PENDING","message":"The independent review is still working in the background. Collect its result when it finishes.","severity":"info"}],"effects":{"files":[],"packages":[],"configuration":[],"network":[],"destructive":[]},"errors":[],"recovery":[],"next_actions":[{"command":"/Users/alex/.local/share/mise/installs/bun/1.3.14/bin/bun /Users/alex/.codex/plugins/cache/safeword/safeword/1.2.0/runtime/cli.js review status 54221d33-b28e-4777-9606-27e92f4259cb","mutates":false,"requires_human":false}],"data":{"command":"review run","status":"pending","review_id":"54221d33-b28e-4777-9606-27e92f4259cb","started_at":"2026-10-24T06:28:52.724Z"}}
