{"schema_version":1,"ok":true,"state":"action_required","changed":false,"findings":[{"code":"REVIEW_PENDING","message":"The independent review is still working in the background. Collect its result when it finishes.","severity":"info"}],"effects":{"files":[],"packages":[],"configuration":[],"network":[],"destructive":[]},"errors":[],"recovery":[],"next_actions":[{"command":"/Users/alex/.local/share/mise/installs/bun/1.3.14/bin/bun /Users/alex/.codex/worktrees/aa92/safeword/packages/cli/src/cli.ts review status 7ab934d3-82c3-435f-83c8-05bea9c8d11a","mutates":false,"requires_human":false}],"data":{"command":"review run","status":"pending","review_id":"7ab934d3-82c3-435f-83c8-05bea9c8d11a","started_at":"2026-10-24T02:16:45.229Z"}}
