{"schema_version":1,"ok":true,"state":"healthy","changed":false,"findings":[{"code":"REVIEW_INDEPENDENCE","message":"A different agent (Claude) checked the work in a separate headless process.","severity":"info"},{"code":"REVIEWER_SUMMARY","message":"The attestation shows the exact proof-plan command failing with exit code 1. There was no signal and no timeout (21.4s of a 180s limit). The expected-failure literal 'Human refusal must name the fixed observation recovery command' appears in the attested stdout, which is complete (1602 bytes, not truncated), and stderr is empty. The proof runs the real public CLI in human mode (no --json, --no-input) on a disposable committed candidate with one uncommitted change to proof configuration (packages/cli/vitest.base.ts). That is the 'When' step of the dirty-input scenario. The proof checks what the actor sees: exit 2, the execution-only label, the named changed file and the commit-or-clean wording all pass. The only assertion that fails is the missing fixed recovery command. The captured output shows the cause is real: it names only 'safeword proof verify-bounded-delivery <id>' and never 'safeword proof observe-bounded-delivery'. Nothing points to a syntax, import, fixture, configuration or infrastructure problem. The failure is the intended missing behavior at the human-rendering boundary.","severity":"info"},{"code":"REVIEWER_FINDING","message":"The scenario's 'Then no proof execution starts' is not checked by this human-mode proof. The test only checks the rendered message, so a regression that launched the fixed lane before refusing would still let it pass. The note says the JSON dirty-input control covers this. Consider adding a check that no runner report or lane execution artifact exists, so this proof also catches that regression.","severity":"warning"},{"code":"REVIEWER_FINDING","message":"The required recovery command comes from the plan's 'one concrete recovery action' and persona guidance, not the literal scenario text. The output's 'commit or clean the candidate and rerun' arguably already covers 'asks for a committed clean candidate'. The added requirement is in scope and fits the accepted recovery behavior, but the trace from that Then step to this exact literal should be recorded in the test-definitions ledger.","severity":"warning"},{"code":"REVIEWER_FINDING","message":"The attested human output prints 'Uncommitted input packages/cli/vitest.base.ts; commit or clean the candidate and rerun' twice. It also lists 'Verify: safeword proof verify-bounded-delivery <id>' as the only command, which points the maintainer at a refused attempt instead of a recovery. The GREEN change should render exactly one concrete next action and remove the duplicate line. Consider asserting the single-action rule, not just that the substring is present.","severity":"warning"},{"code":"REVIEWER_FINDING","message":"The attested environment reports node v24.3.0, but the plan and fixture pin v24.18.1. This RED proof doesn't check the tool version, so the result still stands. However, a later complete-observation proof run on this host would fail on the version assertion for a reason unrelated to the behavior under test.","severity":"info"}],"effects":{"files":[],"packages":[],"configuration":[],"network":[{"kind":"review","target":"claude","operation":"request"}],"destructive":[]},"errors":[],"recovery":[],"next_actions":[],"data":{"command":"review run","status":"approved","review_kind":"executable-red","review_targets":["packages/cli/tests/integration/bounded-observation-human.node.ts","packages/cli/tests/fixtures/bounded-observation.ts",".project/tickets/PPHQN5-observe-bounded-delivery-proof/evidence/proposed-assertion-map.json"],"author_agent":"codex","assigned_reviewer":"claude","actual_reviewer":"claude","reviewer_model":"opus","independence":"cross-agent","reviewer_output":{"schema_version":1,"dispatch_id":"2673d643-6c06-4c75-bd6b-c661ea294ec1","reviewer_agent":"claude","verdict":"approve","summary":"The attestation shows the exact proof-plan command failing with exit code 1. There was no signal and no timeout (21.4s of a 180s limit). The expected-failure literal 'Human refusal must name the fixed observation recovery command' appears in the attested stdout, which is complete (1602 bytes, not truncated), and stderr is empty. The proof runs the real public CLI in human mode (no --json, --no-input) on a disposable committed candidate with one uncommitted change to proof configuration (packages/cli/vitest.base.ts). That is the 'When' step of the dirty-input scenario. The proof checks what the actor sees: exit 2, the execution-only label, the named changed file and the commit-or-clean wording all pass. The only assertion that fails is the missing fixed recovery command. The captured output shows the cause is real: it names only 'safeword proof verify-bounded-delivery <id>' and never 'safeword proof observe-bounded-delivery'. Nothing points to a syntax, import, fixture, configuration or infrastructure problem. The failure is the intended missing behavior at the human-rendering boundary.","findings":[{"severity":"warning","message":"The scenario's 'Then no proof execution starts' is not checked by this human-mode proof. The test only checks the rendered message, so a regression that launched the fixed lane before refusing would still let it pass. The note says the JSON dirty-input control covers this. Consider adding a check that no runner report or lane execution artifact exists, so this proof also catches that regression."},{"severity":"warning","message":"The required recovery command comes from the plan's 'one concrete recovery action' and persona guidance, not the literal scenario text. The output's 'commit or clean the candidate and rerun' arguably already covers 'asks for a committed clean candidate'. The added requirement is in scope and fits the accepted recovery behavior, but the trace from that Then step to this exact literal should be recorded in the test-definitions ledger."},{"severity":"warning","message":"The attested human output prints 'Uncommitted input packages/cli/vitest.base.ts; commit or clean the candidate and rerun' twice. It also lists 'Verify: safeword proof verify-bounded-delivery <id>' as the only command, which points the maintainer at a refused attempt instead of a recovery. The GREEN change should render exactly one concrete next action and remove the duplicate line. Consider asserting the single-action rule, not just that the substring is present."},{"severity":"info","message":"The attested environment reports node v24.3.0, but the plan and fixture pin v24.18.1. This RED proof doesn't check the tool version, so the result still stands. However, a later complete-observation proof run on this host would fail on the version assertion for a reason unrelated to the behavior under test."}]},"excluded_targets":[],"execution_attestation":{"schema_version":1,"argv":["scripts/dev","node","--import","tsx","--test","--test-concurrency=1","packages/cli/tests/integration/bounded-observation-human.node.ts"],"cwd":".","evidence_class":"local-live-host","expected_failure":{"literal":"Human refusal must name the fixed observation recovery command","matched":true},"timeout_ms":180000,"source_fingerprint":"657cb949ec9788dcfff2715163afb004fbfda601c0a61a71fba34152a2f644e0","environment":{"sha256":"6d4602404369d998f651d74e3c04b09214122c18673bb36433c558fb8780fa85","variable_count":60,"platform":"darwin","arch":"arm64","node":"v24.3.0","bun":"1.3.14"},"started_at":"2026-10-24T06:55:58.107Z","finished_at":"2026-10-24T06:56:19.474Z","duration_ms":21367,"termination":{"exit_code":1,"signal":null,"timed_out":false},"stdout":{"excerpt":"✖ human dirty-input refusal includes the fixed recovery command (21251.385667ms)\nℹ tests 1\nℹ suites 0\nℹ pass 0\nℹ fail 1\nℹ cancelled 0\nℹ skipped 0\nℹ todo 0\nℹ duration_ms 21307.410458\n\n✖ failing tests:\n\ntest at packages/cli/tests/integration/bounded-observation-human.node.ts:1:255\n✖ human dirty-input refusal includes the fixed recovery command (21251.385667ms)\n  AssertionError [ERR_ASSERTION]: Human refusal must name the fixed observation recovery command: Execution-only refused: d1164974-415f-4674-b9ab-3d113fa93d3d\n  Uncommitted input packages/cli/vitest.base.ts; commit or clean the candidate and rerun\n  Evidence: /private/var/folders/v4/1hqkg6ln4nd71j_bjw3_xxb00000gn/T/safeword-observer-proof-DaCb8r/state/safeword/bounded-observation/04d3f999c913c08066b6dbe5b04d7024b550d0cff64eb58cb4d0a8aada9bb1e6/d1164974-415f-4674-b9ab-3d113fa93d3d/report.json\n  Verify: safeword proof verify-bounded-delivery d1164974-415f-4674-b9ab-3d113fa93d3d\n  Uncommitted input packages/cli/vitest.base.ts; commit or clean the candidate and rerun\n  \n      at TestContext.<anonymous> (/Users/alex/.codex/worktrees/aa92/safeword/packages/cli/tests/integration/bounded-observation-human.node.ts:38:14)\n      at Test.runInAsyncScope (node:async_hooks:227:14)\n      at Test.run (node:internal/test_runner/test:1325:25)\n      at Test.start (node:internal/test_runner/test:1191:17)\n      at startSubtestAfterBootstrap (node:internal/test_runner/harness:385:17) {\n    generatedMessage: false,\n    code: 'ERR_ASSERTION',\n    actual: false,\n    expected: true,\n    operator: '==',\n    diff: 'simple'\n  }\n","bytes":1602,"sha256":"b490ddbb6ad159eb82ec9776a0b7ac957f65f63427c4db1cb50bd5209e13be0c","truncated":false},"stderr":{"excerpt":"","bytes":0,"sha256":"e3b0c44298fc1c149afbf4c8996fb92427ae41e4649b934ca495991b7852b855","truncated":false}},"review_id":"88816ba2-5af1-43c2-bda5-d762b915b350","review_excluded_targets":[]}}
