{"schema_version":1,"ok":true,"state":"healthy","changed":false,"findings":[{"code":"REVIEW_INDEPENDENCE","message":"A different agent (Claude) checked the work in a separate headless process.","severity":"info"},{"code":"REVIEWER_SUMMARY","message":"The M2 repair now tests a real handover. The scenario installs the registered legacy config guard and runs the real dispatcher for SessionStart. It checks that the SessionStart proof matches exactly, including session_id, plugin root, and manifest digest. It then shows that the plugin skips the PreToolUse effect while the real legacy guard asks for approval. Next it runs the real CLI cleanup preview and the confirmed cleanup, which must end in plugin-mode. It checks that the legacy settings registration is gone and the clean marker exists. Finally it runs the next PreToolUse with the same session, plugin cache, and data directory, and requires exactly one plugin effect. No reload or mutation call is made, and the earlier proof is unchanged. The ticket's probes are covered: skipped cleanup, stale legacy suppression (empty effect log), and duplicate plugin execution (two log lines) would all fail. All three use real collaborators. I found no blocking errors. The remaining gaps are an unasserted file-removal claim, a session check that compares a hardcoded value with itself, and no attached RED or fault-probe evidence.","severity":"info"},{"code":"REVIEWER_FINDING","message":"The ticket's GREEN criterion says cleanup removes the legacy guard's registration and its file. The When step checks only that `settings.hooks.PreToolUse` is empty and the plugin-mode marker is 'clean'. It never checks whether `.safeword/hooks/pre-tool-config-guard.ts` still exists. The handover would still pass if the file stayed, because the dispatcher's `viableLegacyAuthority` also needs the settings entry. Either assert the file's expected state (removed, or kept as project-owned) or reword the ticket claim.","severity":"warning"},{"code":"REVIEWER_FINDING","message":"The 'changed session' fault probe cannot fail on its own terms. `runAuthorityHook` hardcodes `sessionId: 'authority-test'` and the plugin and data paths from the fixture, records them in `authorityInvocations`, and the Then step compares them against those same constants. This only catches someone editing the step code. It does not show that the runtime would behave differently in another session. The dispatcher's PreToolUse path also ignores session_id. Real same-session continuity rests on the shared proof file and data directory, not on this assertion.","severity":"warning"},{"code":"REVIEWER_FINDING","message":"After cleanup, 'no legacy effect' is inferred from the empty settings registration, not observed. The harness simply stops calling `executeLegacyConfigGuard`. `assertLegacyConfigProtection` then checks there is exactly one legacy result, which comes from before cleanup. Treating the settings file as the host registration is reasonable while the host adapter is faked. But the scenario never actually invokes whatever is still registered after cleanup, so it does not prove that nothing runs.","severity":"warning"},{"code":"REVIEWER_FINDING","message":"The packet contains no verification evidence for the steps the ticket requires. The Work Log is empty and there is no RED run against the old fresh fixture, no fault-probe output (skipped cleanup, stale suppression, changed session, duplicate execution), and no full-feature or static-check results. Reading the code suggests the probes would fail as intended, but the 'Tests' section of the ticket has not been shown to be met.","severity":"warning"},{"code":"REVIEWER_FINDING","message":"The scenario still uses a printf effect in place of the real plugin hook body, and a fake Claude adapter. The ticket scopes this explicitly: it proves the dispatcher/cleanup boundary, not the desktop host lifecycle, so this is acceptable.","severity":"info"}],"effects":{"files":[],"packages":[],"configuration":[],"network":[{"kind":"review","target":"claude","operation":"request"}],"destructive":[]},"errors":[],"recovery":[],"next_actions":[],"data":{"command":"review run","status":"approved","review_kind":"quality-review","review_targets":[".project/tickets/117CBF-prove-same-session-plugin-handover/ticket.md","steps/native-claude-plugin.steps.ts","features/native-claude-plugin.feature"],"author_agent":"codex","assigned_reviewer":"claude","actual_reviewer":"claude","reviewer_model":"opus","independence":"cross-agent","reviewer_output":{"schema_version":1,"dispatch_id":"f7221f5c-dda6-471b-9b8e-feb537c286f0","reviewer_agent":"claude","verdict":"approve","summary":"The M2 repair now tests a real handover. The scenario installs the registered legacy config guard and runs the real dispatcher for SessionStart. It checks that the SessionStart proof matches exactly, including session_id, plugin root, and manifest digest. It then shows that the plugin skips the PreToolUse effect while the real legacy guard asks for approval. Next it runs the real CLI cleanup preview and the confirmed cleanup, which must end in plugin-mode. It checks that the legacy settings registration is gone and the clean marker exists. Finally it runs the next PreToolUse with the same session, plugin cache, and data directory, and requires exactly one plugin effect. No reload or mutation call is made, and the earlier proof is unchanged. The ticket's probes are covered: skipped cleanup, stale legacy suppression (empty effect log), and duplicate plugin execution (two log lines) would all fail. All three use real collaborators. I found no blocking errors. The remaining gaps are an unasserted file-removal claim, a session check that compares a hardcoded value with itself, and no attached RED or fault-probe evidence.","findings":[{"severity":"warning","message":"The ticket's GREEN criterion says cleanup removes the legacy guard's registration and its file. The When step checks only that `settings.hooks.PreToolUse` is empty and the plugin-mode marker is 'clean'. It never checks whether `.safeword/hooks/pre-tool-config-guard.ts` still exists. The handover would still pass if the file stayed, because the dispatcher's `viableLegacyAuthority` also needs the settings entry. Either assert the file's expected state (removed, or kept as project-owned) or reword the ticket claim."},{"severity":"warning","message":"The 'changed session' fault probe cannot fail on its own terms. `runAuthorityHook` hardcodes `sessionId: 'authority-test'` and the plugin and data paths from the fixture, records them in `authorityInvocations`, and the Then step compares them against those same constants. This only catches someone editing the step code. It does not show that the runtime would behave differently in another session. The dispatcher's PreToolUse path also ignores session_id. Real same-session continuity rests on the shared proof file and data directory, not on this assertion."},{"severity":"warning","message":"After cleanup, 'no legacy effect' is inferred from the empty settings registration, not observed. The harness simply stops calling `executeLegacyConfigGuard`. `assertLegacyConfigProtection` then checks there is exactly one legacy result, which comes from before cleanup. Treating the settings file as the host registration is reasonable while the host adapter is faked. But the scenario never actually invokes whatever is still registered after cleanup, so it does not prove that nothing runs."},{"severity":"warning","message":"The packet contains no verification evidence for the steps the ticket requires. The Work Log is empty and there is no RED run against the old fresh fixture, no fault-probe output (skipped cleanup, stale suppression, changed session, duplicate execution), and no full-feature or static-check results. Reading the code suggests the probes would fail as intended, but the 'Tests' section of the ticket has not been shown to be met."},{"severity":"info","message":"The scenario still uses a printf effect in place of the real plugin hook body, and a fake Claude adapter. The ticket scopes this explicitly: it proves the dispatcher/cleanup boundary, not the desktop host lifecycle, so this is acceptable."}]},"excluded_targets":[],"review_id":"1d96e4ff-f7cc-430a-970a-734e69925784","review_excluded_targets":[]}}
